{
  "schemaVersion": "session.v1",
  "id": "session-pill-discussion",
  "itemId": "item-pill",
  "createdAt": "2026-06-11T12:15:00.000Z",
  "updatedAt": "2026-06-11T13:05:00.000Z",
  "completedAt": null,
  "status": "in_progress",
  "phase": "conversation",
  "completionPercent": 100,
  "currentTarget": {
    "targetType": "assistant_turn_tts",
    "targetId": "turn-response-001",
    "position": {
      "charOffset": 0,
      "mediaTimeMs": null,
      "segmentIndex": 0,
      "chapterId": null
    }
  },
  "playbackRate": 1
}
